datetime,Unnamed: 0,text,isRetweet,processed_text,topics,top_3_topics,topic_confidences,sentiment,sentiment_score,named_entities,cluster,Climate & Environment,Consumer & Retail,Corporate Sector,Crypto & Digital Assets,Education & Knowledge,Energy & Commodities,Financial Markets,Geopolitics & Policy,Health & Biotech,Legal & Regulation,Macro Finance,Real Estate & Housing,Society & Labor,Tech & Innovation,Transport & Logistics,Uncertain
2025-04-13 21:13:00,751,"I just finished watching 60 Minutes, the FAKE News Show that was scandalously responsible for REMOVING a terrible and incompetently delivered answer, by failed Presidential Candidate Kamala Harris, to an interview on 60 Minutes, just prior to Election Day, and putting in its place a completely different answer to a completely different question, in order to make Kamala look ??coherent.?? Now tonight, with two separate but highly inaccurate stories about ??TRUMP,?? they??re at it again. The people at CBS Fake News just don??t get it!",False,fake news candidate kamala harris election kamala trump cbs fake news finished watching minute show scandalously responsible removing terrible incompetently delivered answer failed presidential interview minute prior day putting place completely different answer completely different question order make look tonight two separate highly inaccurate story people get,['Uncertain'],"Geopolitics & Policy, Society & Labor, Legal & Regulation","[0.017, 0.0, 0.0]",NEGATIVE,0.9975,"['tonight', 'cbs', 'presidential interview minute', 'kamala harris', 'fake news', 'two', 'minute', 'kamala']",2,0,0,0,0,0,0,0,0,0,0,0,0,0,0,0,1
2025-04-11 08:12:00,768,Glad to have you back home.,False,glad back home,['Real Estate & Housing'],"Real Estate & Housing, Society & Labor, Crypto & Digital Assets","[0.797, 0.003, 0.002]",POSITIVE,0.9998,[],2,0,0,0,0,0,0,0,0,0,0,0,1,0,0,0,0
2025-04-10 18:57:00,771,"I am pleased to announce that William ""Billy"" Marshall III, of the Great State of West Virginia, a State I love and won SIX times, as the next Director of the Bureau of Prisons. Billy has a distinguished Law Enforcement career, rising from the ranks of the West Virginia State Police to serving as the current Commissioner of the West Virginia Division of Corrections and Rehabilitation. Billy is a Strong Advocate for LAW AND ORDER. He understands the struggles of our prisons better than anyone, and will help fix our broken Criminal Justice System. Congratulations Billy, you will inspire us all!",False,william billy marshall iii great west virginia six bureau prisons billy law enforcement west virginia west virginia corrections rehabilitation billy strong advocate law and order congratulations billy pleased announce state state love time next director distinguished career rising rank state police serving current commissioner division understands struggle better anyone help fix broken criminal justice system inspire u,['Uncertain'],"Legal & Regulation, Geopolitics & Policy, Society & Labor","[0.154, 0.003, 0.0]",POSITIVE,0.998,"['virginia corrections rehabilitation', 'william billy marshall iii great', 'six', 'west virginia']",2,0,0,0,0,0,0,0,0,0,0,0,0,0,0,0,1
2025-04-10 18:33:00,772,"I am pleased to announce that former Congressman Mark Walker, of North Carolina, a place I love and won SIX times, will be the United States Ambassador-at-Large for International Religious Freedom.A former pastor, Mark was elected unanimously to House Leadership, and did an incredible job as Ranking Member on the House Homeland Security??s Counterterrorism and Intelligence Subcommittee. As Chairman of the Republican Study Committee, Mark helped us secure many Victories. In his new role, Mark will work incredibly hard to expose Human Rights Violations, champion Faith, and help us secure Life Saving Results.Congratulations to Mark, his wonderful wife, Dr. Kelly Walker, a Captain in the U.S. Air Force Reserves, and their three children.",False,congressman mark walker north carolina six united states international religious mark house leadership ranking house homeland intelligence subcommittee republican study committee mark mark human rights violations faith life saving mark u.s. pleased announce former place love time former pastor elected unanimously incredible job member security counterterrorism chairman helped secure many victory new role work incredibly hard expose champion help secure wonderful wife kelly captain air force reserve three child,['Geopolitics & Policy'],"Geopolitics & Policy, Society & Labor, Legal & Regulation","[0.518, 0.011, 0.0]",POSITIVE,0.9971,"['kelly captain air force reserve', 'united states international', 'u.s.', 'north carolina', 'republican study committee', 'three', 'six', 'mark mark', 'mark walker']",2,0,0,0,0,0,0,0,1,0,0,0,0,0,0,0,0
2025-04-10 17:52:00,775,"I am proud to once again endorse Texas Lieutenant Governor, Dan Patrick, for Re-Election.??As Texas Chair of our Presidential Campaigns in 2016, 2020, and 2024, Dan has been an incredible friend to our Movement, helping us WIN BIG in the Primaries and General Elections. In his next Term, Dan will fight tirelessly alongside of us to Secure the Border, Stop Migrant Crime, Grow the Economy, Cut Taxes and Regulations, Champion School Choice, Support our Great Military/Vets, Restore American Energy DOMINANCE, and Strongly Protect our always under siege Second Amendment.??Dan Patrick has my Complete and Total Endorsement ?? He will never let you down!",False,texas lieutenant governor dan patrick texas chair dan win primaries general elections dan border stop migrant crime economy cut taxes regulations champion school choice support great restore american energy dominance dan patrick complete total proud endorse presidential campaign incredible friend movement helping u big next term fight tirelessly alongside u secure grow strongly protect always siege second amendment endorsement never,['Geopolitics & Policy'],"Geopolitics & Policy, Legal & Regulation, Society & Labor","[0.807, 0.001, 0.0]",POSITIVE,0.9985,"['american', 'second', 'dan patrick', 'texas', 'dan patrick texas', 'dan win primaries general']",2,0,0,0,0,0,0,0,1,0,0,0,0,0,0,0,0
2025-04-10 09:35:00,779,"No more Sanctuary Cities! They protect the Criminals, not the Victims. They are disgracing our Country, and are being mocked all over the World. Working on papers to withhold all Federal Funding for any City or State that allows these Death Traps to exist!!!",False,criminals sanctuary city protect victim disgracing country mocked world working paper withhold federal funding city state allows death trap exist,"['Legal & Regulation', 'Geopolitics & Policy']","Legal & Regulation, Geopolitics & Policy, Society & Labor","[0.99, 0.949, 0.009]",NEGATIVE,0.9971,[],2,0,0,0,0,0,0,0,1,0,1,0,0,0,0,0,0
2025-04-10 08:28:00,780,"Great News! ??The Big, Beautiful Bill?? is coming along really well. Republicans are working together nicely. Biggest Tax Cuts in USA History!!! Getting close. DJT",False,great news beautiful bill usa history big coming along really well republican working together nicely biggest tax cut getting close djt,['Macro Finance'],"Macro Finance, Financial Markets, Geopolitics & Policy","[0.978, 0.315, 0.084]",POSITIVE,0.9993,"['republican', 'bill usa']",1,0,0,0,0,0,0,0,0,0,0,1,0,0,0,0,0
2025-04-10 00:45:00,781,"What a day, but more great days coming!!!",False,day great day coming,['Uncertain'],"Financial Markets, Macro Finance, Crypto & Digital Assets","[0.252, 0.047, 0.008]",POSITIVE,0.9998,[],2,0,0,0,0,0,0,0,0,0,0,0,0,0,0,0,1
2025-04-09 23:34:00,782,"Thank you, Vince Molinari. Congratulations on all of your success!",False,vince molinari thank congratulation success,['Financial Markets'],"Financial Markets, Tech & Innovation, Macro Finance","[0.731, 0.186, 0.037]",POSITIVE,0.9998,['vince molinari'],2,0,0,0,0,0,0,1,0,0,0,0,0,0,0,0,0
2025-04-09 18:30:00,783,"It was my Great Honor to welcome the North Dakota State University, 2025 Division 1 Football Champions??to the White House this evening. CONGRATULATIONS!",False,north dakota white house great honor welcome state university division football evening congratulation,['Uncertain'],"Education & Knowledge, Real Estate & Housing, Climate & Environment","[0.0, 0.0, 0.0]",POSITIVE,0.9995,"['white house', 'evening', 'north dakota']",2,0,0,0,0,0,0,0,0,0,0,0,0,0,0,0,1
2025-04-09 15:30:00,785,CONGRATULATIONS!,False,congratulations,['Uncertain'],"Financial Markets, Tech & Innovation, Corporate Sector","[0.052, 0.02, 0.019]",POSITIVE,0.9998,[],2,0,0,0,0,0,0,0,0,0,0,0,0,0,0,0,1
2025-04-09 09:37:00,788,THIS IS A GREAT TIME TO BUY!!! DJT,False,great time to buy djt,"['Consumer & Retail', 'Real Estate & Housing', 'Crypto & Digital Assets', 'Financial Markets', 'Tech & Innovation']","Consumer & Retail, Real Estate & Housing, Crypto & Digital Assets","[0.997, 0.99, 0.99]",POSITIVE,0.9998,[],5,0,1,0,1,0,0,1,0,0,0,0,1,0,1,0,0
2025-04-09 09:33:00,789,BE COOL! Everything is going to work out well. The USA will be bigger and better than ever before!,False,usa cool everything going work well bigger better ever,['Tech & Innovation'],"Tech & Innovation, Financial Markets, Corporate Sector","[0.973, 0.013, 0.013]",POSITIVE,0.9996,[],1,0,0,0,0,0,0,0,0,0,0,0,0,0,1,0,0
2025-04-09 07:58:00,792,"Republicans, it is more important now, than ever, that we pass THE ONE, BIG, BEAUTIFUL BILL. The USA will Soar like never before!!!",False,the one big beautiful usa republican important ever pas bill soar like never,['Financial Markets'],"Financial Markets, Geopolitics & Policy, Macro Finance","[0.89, 0.215, 0.004]",POSITIVE,0.9991,"['republican', 'one']",2,0,0,0,0,0,0,1,0,0,0,0,0,0,0,0,0
2025-04-08 18:11:00,796,"I had a very good meeting today with the Speaker of the House and some of our more Conservative Members, all great people. I let them know that, I AM FOR MAJOR SPENDING CUTS! WE ARE GOING TO DO REDUCTIONS, hopefully in excess of $1 Trillion Dollars, all of which will go into ??The One, Big, Beautiful Bill.?? I, along with House Members and Senators, will be pushing very hard to get these large scale Spending Cuts done, but we must get the Bill approved NOW. MAKE AMERICA GREAT AGAIN!",False,house major spending cuts big beautiful house senators cuts bill now make america good meeting speaker conservative member great people let know going reduction hopefully excess trillion dollar go one along member pushing hard get large scale done must get approved great,['Macro Finance'],"Macro Finance, Geopolitics & Policy, Financial Markets","[0.701, 0.025, 0.0]",POSITIVE,0.9992,"['one', 'house', 'america']",1,0,0,0,0,0,0,0,0,0,0,1,0,0,0,0,0
2025-04-07 10:32:00,808,"??Rates are plummeting, oil prices are plummeting, deregulation is happening. President Trump is not going to bend...""",False,trump rate plummeting oil price plummeting deregulation happening president going bend,"['Energy & Commodities', 'Financial Markets', 'Macro Finance', 'Geopolitics & Policy']","Energy & Commodities, Financial Markets, Macro Finance","[1.0, 1.0, 0.999]",NEGATIVE,0.9987,[],1,0,0,0,0,0,1,1,1,0,0,1,0,0,0,0,0
2025-04-07 10:09:00,814,??More than 50 countries have reached out to the president to begin a negotiation????,False,country reached president begin,['Geopolitics & Policy'],"Geopolitics & Policy, Real Estate & Housing, Crypto & Digital Assets","[0.979, 0.0, 0.0]",POSITIVE,0.9975,[],1,0,0,0,0,0,0,0,1,0,0,0,0,0,0,0,0
2025-04-07 10:04:00,816,This is NOT SUSTAINABLE! The United States can't lose $1.9 trillion on trade??,False,not united states sustainable ca lose trillion,"['Financial Markets', 'Macro Finance', 'Geopolitics & Policy', 'Climate & Environment']","Financial Markets, Macro Finance, Geopolitics & Policy","[0.996, 0.995, 0.987]",NEGATIVE,0.9995,[],1,1,0,0,0,0,0,1,1,0,0,1,0,0,0,0,0
2025-04-07 09:33:00,817,Seeing the World Champion Los Angeles Dodgers at 11:00 A.M. Exciting!!! DJT,False,los angeles seeing world champion dodger exciting djt,['Uncertain'],"Real Estate & Housing, Climate & Environment, Education & Knowledge","[0.0, 0.0, 0.0]",POSITIVE,0.9997,['los angeles'],5,0,0,0,0,0,0,0,0,0,0,0,0,0,0,0,1
2025-04-04 15:35:00,826,ONLY THE WEAK WILL FAIL!,False,the weak fail,['Financial Markets'],"Financial Markets, Crypto & Digital Assets, Health & Biotech","[0.994, 0.368, 0.067]",NEGATIVE,0.9998,[],1,0,0,0,0,0,0,1,0,0,0,0,0,0,0,0,0
2025-04-04 13:34:00,827,"My Administration has been working very hard on a Deal to SAVE TIKTOK, and we have made tremendous progress. The Deal requires more work to ensure all necessary approvals are signed, which is why I am signing an Executive Order to keep TikTok up and running for an additional 75 days. We hope to continue working in Good Faith with China, who I understand are not very happy about our Reciprocal Tariffs (Necessary for Fair and Balanced Trade between China and the U.S.A.!). This proves that Tariffs are the most powerful Economic tool, and very important to our National Security! We do not want TikTok to ??go dark.?? We look forward to working with TikTok and China to close the Deal. Thank you for your attention to this matter!",False,administration save deal tiktok good china reciprocal tariffs fair balanced trade china u.s.a. national tiktok tiktok china deal working hard made tremendous progress requires work ensure necessary approval signed signing executive order keep running additional day hope continue working faith understand happy necessary prof powerful economic tool important security want look forward working close thank attention matter,"['Geopolitics & Policy', 'Macro Finance']","Geopolitics & Policy, Macro Finance, Corporate Sector","[0.977, 0.68, 0.004]",POSITIVE,0.9988,"['china', 'additional day']",1,0,0,0,0,0,0,0,1,0,0,1,0,0,0,0,0
2025-04-04 09:25:00,830,"CHINA PLAYED IT WRONG, THEY PANICKED - THE ONE THING THEY CANNOT AFFORD TO DO!",False,china played they panicked wrong one thing afford,"['Geopolitics & Policy', 'Financial Markets', 'Macro Finance']","Geopolitics & Policy, Financial Markets, Macro Finance","[0.995, 0.991, 0.988]",NEGATIVE,0.9982,"['china', 'one']",1,0,0,0,0,0,0,1,1,0,0,1,0,0,0,0,0
2025-04-03 16:48:00,836,A Great Ad by FORD!,False,great ford ad,['Uncertain'],"Consumer & Retail, Corporate Sector, Financial Markets","[0.028, 0.016, 0.008]",POSITIVE,0.9986,['ford'],2,0,0,0,0,0,0,0,0,0,0,0,0,0,0,0,1
2025-04-03 13:07:00,838,"APRIL 2, 2025????????",False,april,['Uncertain'],"Financial Markets, Real Estate & Housing, Macro Finance","[0.484, 0.243, 0.116]",POSITIVE,0.9973,['april'],2,0,0,0,0,0,0,0,0,0,0,0,0,0,0,0,1
2025-04-03 08:33:00,840,"THE OPERATION IS OVER! THE PATIENT LIVED, AND IS HEALING. THE PROGNOSIS IS THAT THE PATIENT WILL BE FAR STRONGER, BIGGER, BETTER, AND MORE RESILIENT THAN EVER BEFORE. MAKE AMERICA GREAT AGAIN!!!",False,operation the patient and prognosis the patient far bigger better and make america lived healing stronger resilient ever great,['Health & Biotech'],"Health & Biotech, Society & Labor, Geopolitics & Policy","[0.999, 0.001, 0.0]",POSITIVE,0.9995,['america'],2,0,0,0,0,0,0,0,0,1,0,0,0,0,0,0,0
2025-04-01 20:09:00,848,"Jimmy Patronis WINS BIG! Congratulations Jimmy. DONALD J. TRUMP, PRESIDENT!",False,jimmy patronis wins donald big congratulation trump president,['Uncertain'],"Geopolitics & Policy, Financial Markets, Corporate Sector","[0.045, 0.0, 0.0]",POSITIVE,0.9996,"['jimmy patronis', 'donald big congratulation']",2,0,0,0,0,0,0,0,0,0,0,0,0,0,0,0,1
2025-04-01 19:24:00,850,RANDY FINE WINS!!!,False,randy fine win,['Financial Markets'],"Financial Markets, Macro Finance, Geopolitics & Policy","[0.696, 0.021, 0.01]",POSITIVE,0.9998,['randy fine'],2,0,0,0,0,0,0,1,0,0,0,0,0,0,0,0,0
2025-04-01 16:53:00,852,"REPUBLICANS MUST DEFUND AND TOTALLY DISASSOCIATE THEMSELVES FROM NPR & PBS, THE RADICAL LEFT ??MONSTERS?? THAT SO BADLY HURT OUR COUNTRY!",False,must totally disassociate pbs the radical that republican defund npr left monster badly hurt country,['Uncertain'],"Geopolitics & Policy, Society & Labor, Financial Markets","[0.051, 0.001, 0.0]",NEGATIVE,0.9986,"['republican', 'pbs']",2,0,0,0,0,0,0,0,0,0,0,0,0,0,0,0,1
2025-04-01 11:21:00,855,"My telephone call with President El-Sisi, of Egypt, went very well. We discussed numerous topics, among which was the tremendous Military progress we have made against the Ship??destroying Houthis in Yemen ?? Also discussed was Gaza, and possible solutions, Military preparedness, etc.",False,egypt yemen gaza military telephone call president went well discussed numerous topic among tremendous progress made ship destroying houthis also discussed possible solution preparedness etc,['Geopolitics & Policy'],"Geopolitics & Policy, Education & Knowledge, Transport & Logistics","[0.991, 0.0, 0.0]",POSITIVE,0.9978,"['egypt', 'yemen', 'gaza']",2,0,0,0,0,0,0,0,1,0,0,0,0,0,0,0,0
2025-03-31 14:48:00,858,"In two months, there has been more Private Investment spoken for, and/or committed to, than in four years of the Sleepy Joe Biden Administration ?? A fact that the Fake News hates talking about!",False,private investment sleepy joe biden administration fake news two month spoken committed four year fact hate talking,"['Financial Markets', 'Corporate Sector', 'Crypto & Digital Assets', 'Macro Finance']","Financial Markets, Corporate Sector, Crypto & Digital Assets","[0.997, 0.982, 0.941]",NEGATIVE,0.9972,"['joe biden administration fake', 'two month', 'four year']",2,0,0,1,1,0,0,1,0,0,0,1,0,0,0,0,0
2025-03-31 09:30:00,863,"America First Patriot Randy Fine is running to represent the Wonderful People of Florida??s 6th Congressional District! A highly successful, Harvard educated businessman, and greatly respected State Legislator, Randy has been a tremendous Voice for MAGA. In Congress, Randy will be",False,america patriot randy fine wonderful people of florida harvard randy maga congress randy first running represent congressional district highly successful educated businessman greatly respected state legislator tremendous voice,['Uncertain'],"Geopolitics & Policy, Education & Knowledge, Society & Labor","[0.093, 0.015, 0.004]",POSITIVE,0.9996,"['first', 'congress', 'patriot randy fine wonderful', 'florida', 'america', 'randy maga']",2,0,0,0,0,0,0,0,0,0,0,0,0,0,0,0,1
2025-03-31 09:30:00,864,"Jimmy Patronis, Chief Financial Officer and Fire Marshall for the Great State of Florida, is running an incredible Campaign for Congress in Florida??s 1st Congressional District! A fourth generation Floridian from the beautiful Panhandle, and owner of an iconic seafood restaurant,",False,jimmy patronis fire marshall great florida congress florida panhandle chief financial officer state running incredible campaign congressional district fourth generation floridian beautiful owner iconic seafood restaurant,['Uncertain'],"Corporate Sector, Geopolitics & Policy, Macro Finance","[0.179, 0.033, 0.015]",POSITIVE,0.998,"['fourth', 'marshall great florida', 'congress', 'jimmy', 'florida']",2,0,0,0,0,0,0,0,0,0,0,0,0,0,0,0,1
2025-03-30 19:37:00,866,"I was just informed by Prime Minister Starmer of the United Kingdom, that they caught the terrorists who attacked the beautiful Turnberry, in Scotland. They did serious damage, and will hopefully be treated harshly. The three people who did this are in prison. You cannot let things like this attack happen, and I greatly appreciate the work of Prime Minister Starmer, and UK Law Enforcement.",False,united kingdom turnberry scotland starmer uk law enforcement informed prime minister caught terrorist attacked beautiful serious damage hopefully treated harshly three people prison let thing like attack happen greatly appreciate work prime minister,['Geopolitics & Policy'],"Geopolitics & Policy, Legal & Regulation, Society & Labor","[0.787, 0.456, 0.002]",POSITIVE,0.9979,"['united kingdom', 'three', 'uk law enforcement']",2,0,0,0,0,0,0,0,1,0,0,0,0,0,0,0,0
2025-03-30 19:37:00,867,"Kristen Welker??s entire first half hour of the Lowly Rated Meet the Fake Press this morning, was devoted to the boring Signal Witch Hunt. She doesn??t want to talk in detail about anything that matters like how well we are doing against the Houthis, substantive Peace Talks with Russia and Ukraine or, Iran, Iran, Iran. She wastes my Administration??s time by talking to them about ??NOTHING.?? Why can??t NBC, one of the Worst Broadcasters on Television, hire people that are honest and credible? The reason they don??t is because their Chairman, Brian Roberts, is a pathetic Loser, who is petrified of the Left, and always will be. Comcast??s MSNBC and NBC have fought me for years, spending almost all of their waking hours making up Fake Stories ?? and look, I??m PRESIDENT, with really high Poll Numbers and Great Accomplishments. Good job Brian!",False,kristen welker lowly rated fake houthis russia ukraine iran iran iran administration nbc worst broadcasters television brian roberts loser left comcast msnbc nbc fake stories great accomplishments brian entire first half hour meet press morning devoted boring signal witch hunt want talk detail anything matter like well substantive peace talk waste time talking one hire people honest credible reason chairman pathetic petrified always fought year spending almost waking hour making look president really high poll number good job,['Geopolitics & Policy'],"Geopolitics & Policy, Corporate Sector, Society & Labor","[0.849, 0.003, 0.0]",NEGATIVE,0.9979,"['msnbc', 'year', 'nbc worst', 'almost waking hour', 'russia', 'nbc', 'entire first half hour', 'iran', 'ukraine']",2,0,0,0,0,0,0,0,1,0,0,0,0,0,0,0,0
2025-03-29 14:23:00,875,Thank you Faye ?? So honored with your words!,False,faye thank honored word,['Uncertain'],"Financial Markets, Society & Labor, Crypto & Digital Assets","[0.019, 0.008, 0.001]",POSITIVE,0.9998,['faye thank'],2,0,0,0,0,0,0,0,0,0,0,0,0,0,0,0,1
2025-03-28 16:52:00,876,"My Administration is breaking all modern Presidential Staffing Records since taking Office on January 20th. The Presidential Personnel Office has made over 2,200 offers, all accepted, to exceptionally qualified Candidates, who are helping us MAKE AMERICA GREAT AGAIN. We have sent more Nominations to the Senate than anyone ever before, and will continue to hire America First Patriots as we work together to unleash our Nation??s, Golden Age!",False,administration make america senate america golden age breaking modern presidential staffing record since taking office january presidential personnel office made offer accepted exceptionally qualified candidate helping u great sent nomination anyone ever continue hire first patriot work together unleash nation,['Geopolitics & Policy'],"Geopolitics & Policy, Society & Labor, Legal & Regulation","[0.848, 0.0, 0.0]",POSITIVE,0.9984,"['senate america golden', 'january', 'first']",2,0,0,0,0,0,0,0,1,0,0,0,0,0,0,0,0
2025-03-28 15:17:00,877,"I am pleased to announce that Mark Brnovich will be our next United States Ambassador to Serbia. Mark is a proud Veteran of the Army National Guard, and previously served as Attorney General for the Great State of Arizona. As the son of refugees who fled communism, Mark will be a strong advocate for Freedom, and always put AMERICA FIRST. Congratulations Mark!",False,mark brnovich united states serbia mark army national guard great arizona mark freedom america congratulations mark pleased announce next ambassador proud veteran previously served attorney general son refugee fled communism strong advocate always put first,['Geopolitics & Policy'],"Geopolitics & Policy, Legal & Regulation, Society & Labor","[0.941, 0.041, 0.0]",POSITIVE,0.9992,"['first', 'serbia mark army national guard', 'freedom america', 'arizona', 'mark brnovich']",2,0,0,0,0,0,0,0,1,0,0,0,0,0,0,0,0
2025-03-28 11:10:00,881,"I just finished speaking with Prime Minister Mark Carney, of Canada. It was an extremely productive call, we agree on many things, and will be meeting immediately after Canada??s upcoming Election to work on elements of Politics, Business, and all other factors, that will end up being great for both the United States of America and Canada. Thank you for your attention to this matter!",False,mark carney canada canada politics business united states america canada finished speaking prime minister extremely productive call agree many thing meeting immediately upcoming election work element factor end great thank attention matter,['Geopolitics & Policy'],"Geopolitics & Policy, Corporate Sector, Society & Labor","[0.949, 0.003, 0.0]",POSITIVE,0.999,"['mark carney canada', 'canada', 'united states america canada']",2,0,0,0,0,0,0,0,1,0,0,0,0,0,0,0,0
2025-03-28 09:38:00,883,??TRUMP IS ALWAYS RIGHT!?? This from the New York Times!,False,trump new york times always right,"['Financial Markets', 'Geopolitics & Policy']","Financial Markets, Geopolitics & Policy, Macro Finance","[0.967, 0.509, 0.083]",POSITIVE,0.9998,['trump new york times'],2,0,0,0,0,0,0,1,1,0,0,0,0,0,0,0,0
