datetime,Unnamed: 0,text,isRetweet,processed_text,topics,top_3_topics,topic_confidences,sentiment,sentiment_score,named_entities,cluster,Climate & Environment,Consumer & Retail,Corporate Sector,Crypto & Digital Assets,Education & Knowledge,Energy & Commodities,Financial Markets,Geopolitics & Policy,Health & Biotech,Legal & Regulation,Macro Finance,Real Estate & Housing,Society & Labor,Tech & Innovation,Transport & Logistics,Uncertain
2025-07-09 20:29:00,0,"I am pleased to announce that I am directing our GREAT Secretary of Transportation, Sean Duffy, to be Interim Administrator of NASA. Sean is doing a TREMENDOUS job in handling our Country??s Transportation Affairs, including creating a state-of-the-art Air Traffic Control systems, while at the same time rebuilding our roads and bridges, making them efficient, and beautiful, again. He will be a fantastic leader of the ever more important Space Agency, even if only for a short period of time. Congratulations, and thank you, Sean!",False,great transportation sean duffy interim nasa sean tremendous country transportation affairs air traffic control space agency pleased announce directing secretary administrator job handling including creating system time rebuilding road bridge making efficient beautiful fantastic leader ever important even short period time congratulation thank,['Transport & Logistics'],"Transport & Logistics, Corporate Sector, Geopolitics & Policy","[0.956, 0.013, 0.006]",POSITIVE,0.9994,"['sean', 'nasa']",2,0,0,0,0,0,0,0,0,0,0,0,0,0,0,1,0
2025-07-09 20:13:00,2,"HAPPY BIRTHDAY TO SENATOR LINDSEY GRAHAM! He is always there when I need him, and I hope everyone in the Great State of South Carolina will help Lindsey have a BIG WIN in his Re-Election bid next year. MAKE AMERICA GREAT AGAIN!",False,lindsey great south carolina lindsey big make america happy birthday senator graham always need hope everyone state help win bid next year,['Uncertain'],"Geopolitics & Policy, Society & Labor, Legal & Regulation","[0.294, 0.0, 0.0]",POSITIVE,0.9973,"['south carolina', 'graham', 'next year']",2,0,0,0,0,0,0,0,0,0,0,0,0,0,0,0,1
2025-07-09 20:11:00,4,"Senator Roger Marshall is an incredibly strong advocate for the wonderful people of Kansas, a State I love, and WON BIG, in 2016, 2020, and 2024!??A distinguished Medical Doctor and U.S. Army Veteran, Roger knows how to Defend our Country, Support our Brave Military/Veterans, and Ensure PEACE THROUGH STRENGTH. In the U.S. Senate, Roger is working hard to Champion our Great Farmers and American Agriculture, Grow our Economy, Cut Taxes and Regulations, Help Secure our now VERY Secure (Record Setting!) Southern Border, Champion American Energy DOMINANCE, and Defend our always under siege Second Amendment.??KANSAS, Roger Marshall has my Complete and Total Endorsement for Re-Election ?? HE WILL NEVER LET YOU DOWN!",False,roger marshall kansas won medical doctor u.s. army veteran roger support brave ensure peace u.s. senate roger great farmers american agriculture grow cut taxes regulations help secure very record setting southern border champion american energy dominance kansas roger marshall complete total senator incredibly strong advocate wonderful people state love big distinguished know defend country strength working hard economy defend always siege second amendment endorsement never,['Geopolitics & Policy'],"Geopolitics & Policy, Legal & Regulation, Energy & Commodities","[0.978, 0.003, 0.001]",POSITIVE,0.9992,"['roger great', 'american', 'kansas', 'second', 'roger marshall', 'senate', 'roger support brave', 'u.s.']",2,0,0,0,0,0,0,0,1,0,0,0,0,0,0,0,0
2025-07-09 11:36:00,10,"Nevada: On Saturday, July 12th, GET OUT AND VOTE for Michael J. McDonald for Chair of the Republican Party, and the entire Executive Board: Jim Hindle, Barbara Hawn, Kathy Njus, Bruce Parks, and Jesse Law. We had a Historic WIN in Nevada in November, and these Great American Patriots will continue to fight tirelessly to secure Republican Victories in 2026, and beyond ?? THEY ARE FANTASTIC. THANK YOU NEVADA!",False,nevada get michael j. mcdonald republican party jim hindle barbara hawn kathy njus bruce parks jesse law historic nevada american patriots republican thank saturday july vote chair entire executive board win november great continue fight tirelessly secure victory beyond fantastic,['Uncertain'],"Geopolitics & Policy, Legal & Regulation, Corporate Sector","[0.008, 0.001, 0.001]",POSITIVE,0.999,"['november', 'michael j. mcdonald republican party', 'nevada', 'jim hindle', 'saturday july', 'republican', 'nevada american']",2,0,0,0,0,0,0,0,0,0,0,0,0,0,0,0,1
2025-07-09 10:00:00,13,"Our Fed Rate is AT LEAST 3 Points too high. ??Too Late?? is costing the U.S. 360 Billion Dollars a Point, PER YEAR, in refinancing costs. No Inflation, COMPANIES POURING INTO AMERICA. ??The hottest Country in the World!?? LOWER THE RATE!!!",False,too late u.s. billion dollars per companies into rate fed least point high costing point year refinancing cost inflation pouring america hottest country world lower,"['Financial Markets', 'Macro Finance', 'Corporate Sector']","Financial Markets, Macro Finance, Corporate Sector","[0.999, 0.998, 0.982]",NEGATIVE,0.999,[],1,0,0,1,0,0,0,1,0,0,0,1,0,0,0,0,0
2025-07-08 20:59:00,17,"It has been brought to my attention that the Great State of Florida, which I won BIG three times, and where I am a proud Resident, has renamed an important four-mile stretch of Southern Boulevard, in Palm Beach County, to ??PRESIDENT DONALD J. TRUMP BOULEVARD.?? Thank you to Palm Beach County, Governor Ron DeSantis, and all of Florida??s great State Lawmakers, on granting me this wonderful honor! I LOVE FLORIDA!",False,great florida southern boulevard palm donald j. beach county ron desantis florida brought attention state big three time proud resident renamed important stretch president trump thank governor state lawmaker granting wonderful honor love,['Uncertain'],"Geopolitics & Policy, Society & Labor, Corporate Sector","[0.027, 0.006, 0.001]",POSITIVE,0.9998,"['donald j. beach county ron desantis', 'great florida southern boulevard', 'three', 'florida']",2,0,0,0,0,0,0,0,0,0,0,0,0,0,0,0,1
2025-07-06 22:12:00,24,"I am pleased to announce that the UNITED STATES TARIFF Letters, and/or Deals, with various Countries from around the World, will be delivered starting 12:00 P.M. (Eastern), Monday, July 7th. Thank you for your attention to this matter! DONALD J. TRUMP, President of The United States of America.",False,united tariff letters eastern july donald united states america pleased announce deal various country around world delivered starting monday thank attention matter trump president,['Geopolitics & Policy'],"Geopolitics & Policy, Macro Finance, Financial Markets","[0.993, 0.32, 0.032]",POSITIVE,0.9994,"['monday', 'united states america']",1,0,0,0,0,0,0,0,1,0,0,0,0,0,0,0,0
2025-07-06 19:52:00,25,"GOD BLESS ALL OF THE PEOPLE WHO HAVE GONE THROUGH SO MUCH, AND GOD BLESS THE STATE OF TEXAS!",False,the people gone and state of god bless much god bless texas,['Geopolitics & Policy'],"Geopolitics & Policy, Society & Labor, Crypto & Digital Assets","[0.717, 0.394, 0.0]",POSITIVE,0.9991,"['texas', 'god']",2,0,0,0,0,0,0,0,1,0,0,0,0,0,0,0,0
2025-07-06 18:20:00,26,"I am saddened to watch Elon Musk go completely ??off the rails,?? essentially becoming a TRAIN WRECK over the past five weeks. He even wants to start a Third Political Party, despite the fact that they have never succeeded in the United States - The System seems not designed for them. The one thing Third Parties are good for is the creation of Complete and Total DISRUPTION & CHAOS, and we have enough of that with the Radical Left Democrats, who have lost their confidence and their minds! Republicans, on the other hand, are a smooth running ??machine,?? that just passed the biggest Bill of its kind in the History of our Country. It is a Great Bill but, unfortunately for Elon, it eliminates the ridiculous Electric Vehicle (EV) Mandate, which would have forced everyone to buy an Electric Car in a short period of time. I have been strongly opposed to that from the very beginning. People are now allowed to buy whatever they want - Gasoline Powered, Hybrids (which are doing very well), or New Technologies as they come about - No more EV Mandate. I have campaigned on this for two years and, quite honestly, when Elon gave me his total and unquestioned Endorsement, I asked him whether or not he knew that I was going to terminate the EV Mandate - It was in every speech I made, and in every conversation I had. He said he had no problems with that - I was very surprised! Additionally, Elon asked that one of his close friends run NASA and, while I thought his friend was very good, I was surprised to learn that he was a blue blooded Democrat, who had never contributed to a Republican before. Elon probably was, also. I also thought it inappropriate that a very close friend of Elon, who was in the Space Business, run NASA, when NASA is such a big part of Elon??s corporate life. My Number One charge is to protect the American Public!",False,elon musk train united states system complete total chaos radical left democrats bill great bill elon electric vehicle electric car gasoline powered hybrids new technologies elon ev mandate elon nasa republican elon elon space business nasa nasa elon american public saddened watch go completely rail essentially becoming wreck past five week even want start third political party despite fact never succeeded seems designed one thing third party good creation disruption enough lost confidence mind republican hand smooth running machine passed biggest kind history country unfortunately eliminates ridiculous would forced everyone buy short period time strongly opposed beginning people allowed buy whatever want well come campaigned two year quite honestly gave unquestioned endorsement asked whether knew going terminate every speech made every conversation problem surprised additionally asked one close friend run thought friend good surprised learn blue blooded never contributed probably also also thought inappropriate close friend run big part corporate life number one charge protect,['Geopolitics & Policy'],"Geopolitics & Policy, Corporate Sector, Society & Labor","[0.879, 0.089, 0.017]",NEGATIVE,0.9976,"['united states', 'one', 'two year', 'nasa', 'past five week', 'elon american', 'nasa nasa', 'third', 'bill elon', 'republican', 'democrats', 'elon musk']",2,0,0,0,0,0,0,0,1,0,0,0,0,0,0,0,0
2025-07-05 16:48:00,28,"The One Big Beautiful Bill will deliver the strongest border on Earth, the strongest economy on Earth, the strongest military on Earth, & ensure the United States of America will remain the strongest country anywhere on this beautiful planet of ours??",False,beautiful bill earth earth earth united states america one big deliver strongest border strongest economy strongest military ensure remain strongest country anywhere planet,['Geopolitics & Policy'],"Geopolitics & Policy, Climate & Environment, Macro Finance","[0.994, 0.001, 0.0]",POSITIVE,0.9991,"['one', 'america']",1,0,0,0,0,0,0,0,1,0,0,0,0,0,0,0,0
2025-07-04 23:40:00,31,HAPPY 4TH OF JULY! ????????????????????,False,july happy,['Uncertain'],"Financial Markets, Macro Finance, Real Estate & Housing","[0.035, 0.031, 0.013]",POSITIVE,0.9999,['july'],2,0,0,0,0,0,0,0,0,0,0,0,0,0,0,0,1
2025-07-04 10:27:00,33,Republican Strategist T.J. McCormack was fantastic this morning on NewsMax. He really knows his ??stuff!??,False,republican strategist newsmax mccormack fantastic morning really know stuff,['Financial Markets'],"Financial Markets, Geopolitics & Policy, Education & Knowledge","[0.904, 0.129, 0.007]",POSITIVE,0.9986,"['republican', 'morning']",2,0,0,0,0,0,0,1,0,0,0,0,0,0,0,0,0
2025-07-04 01:31:00,35,WOW! 218-2. Has a number like that ever happened before???,False,wow number like ever happened,['Uncertain'],"Financial Markets, Macro Finance, Crypto & Digital Assets","[0.005, 0.005, 0.003]",POSITIVE,0.9995,[],2,0,0,0,0,0,0,0,0,0,0,0,0,0,0,0,1
2025-07-03 23:50:00,36,"RT @rapidresponse47President @realDonaldTrump: ""As President of the United States, I am proclaiming here and now that America is NEVER going Communist in any way, shape, form ?? and that includes New York City.""",True,united states america communist new york city rt realdonaldtrump president proclaiming never going way shape form includes,['Geopolitics & Policy'],"Geopolitics & Policy, Society & Labor, Financial Markets","[0.983, 0.036, 0.004]",NEGATIVE,0.9978,"['new york city', 'united states america']",2,0,0,0,0,0,0,0,1,0,0,0,0,0,0,0,0
2025-07-03 23:50:00,37,"RT @rapidresponse47President @realDonaldTrump: Exactly one year from tomorrow, we will celebrate the 250th anniversary of America's founding...This evening, we are officially launching ""AMERICA 250"" ?? an enormous, year-long, nationwide celebration of our heritage, our flag, and our glorious American freedom. ????????",True,america american rt realdonaldtrump exactly one year tomorrow celebrate anniversary founding evening officially launching enormous nationwide celebration heritage flag glorious freedom,['Geopolitics & Policy'],"Geopolitics & Policy, Society & Labor, Corporate Sector","[0.931, 0.0, 0.0]",POSITIVE,0.9978,"['tomorrow', 'american', 'evening', 'one year', 'america']",2,0,0,0,0,0,0,0,1,0,0,0,0,0,0,0,0
2025-07-03 23:50:00,38,"I??m on Air Force One, traveling back to Washington from the Great State of Iowa, with many of our wonderful and talented Cabinet Secretaries, including Kristi Noem, Doug Burgum, Brooke Rollins, Lee Zeldin, Matt Whitaker of NATO fame, and others in the Administration like Steve Miller, James Blair, SUPERSTAR Karoline Leavitt, and the legendary, first female Chief of Staff, Susie Wiles, etc., including terrific Members of Congress, Ashley Hinson, Zach Nunn, Randy Feenstra, and Mariannette Miller-Meeks, and we??re watching a GREAT guy on Television ?? His name is Trace Gallagher, of FoxNews, a totally professional newsman who, at the same time, is highly entertaining, and very interesting. He interviewed me once in California. Keep up the GREAT work, Trace!",False,air washington great iowa cabinet kristi noem doug burgum brooke rollins lee zeldin matt whitaker nato administration steve miller james blair superstar karoline leavitt susie wiles congress ashley hinson zach nunn randy feenstra mariannette miller-meeks great television trace gallagher foxnews california great trace force one traveling back state many wonderful talented secretary including fame others like legendary first female chief staff including terrific member watching guy name totally professional newsman time highly entertaining interesting interviewed keep work,['Uncertain'],"Corporate Sector, Geopolitics & Policy, Legal & Regulation","[0.046, 0.005, 0.001]",POSITIVE,0.9995,"['congress ashley hinson zach', 'mariannette miller', 'nato', 'first', 'kristi noem doug burgum', 'matt whitaker', 'james blair', 'air washington great iowa', 'nunn', 'california', 'lee zeldin', 'steve miller', 'karoline leavitt susie wiles']",2,0,0,0,0,0,0,0,0,0,0,0,0,0,0,0,1
2025-07-03 23:31:00,41,"I??m on Air Force One, traveling back to Washington from the Great State of Iowa, with many of our wonderful and talented Cabinet Secretaries, including Kristi Noem, Doug Burgum, Brooke Rollins, Lee Zeldin, and others in the Administration like Steve Miller, James Blair, SUPERSTAR Karoline Leavitt, and the legendary, first female Chief of Staff, Susie Wiles, etc., and we??re watching a GREAT guy on Television ?? His name is Trace Gallagher, on FoxNews, a total professional newsman who, at the same time, is entertaining and very interesting. Keep up the GREAT work Trace!",False,air washington great iowa cabinet kristi noem doug burgum brooke rollins lee zeldin administration steve miller james blair superstar karoline leavitt susie wiles great television trace gallagher foxnews great force one traveling back state many wonderful talented secretary including others like legendary first female chief staff watching guy name total professional newsman time entertaining interesting keep work,['Uncertain'],"Corporate Sector, Geopolitics & Policy, Legal & Regulation","[0.007, 0.003, 0.0]",POSITIVE,0.9994,"['first', 'james blair', 'kristi noem doug burgum', 'karoline leavitt susie', 'air washington great iowa', 'lee zeldin', 'steve miller']",2,0,0,0,0,0,0,0,0,0,0,0,0,0,0,0,1
2025-07-03 19:13:00,44,"Great job by the Speaker of the House, Mike Johnson, who spearheaded the drive in Congress for the approval of the ??ONE BIG BEAUTIFUL BILL ACT.?? He has Great Strength and Wisdom, and will go down as one of the most successful Speakers of the House in History, maybe even the BEST OF THEM ALL. Thank you Mike, and congratulations on a job well done!",False,great house mike johnson congress great strength wisdom house history best of them mike job speaker spearheaded drive approval one big beautiful bill go one successful speaker maybe even thank congratulation job well done,['Uncertain'],"Education & Knowledge, Geopolitics & Policy, Real Estate & Housing","[0.041, 0.01, 0.005]",POSITIVE,0.9996,"['one', 'mike johnson', 'congress', 'great house', 'mike']",2,0,0,0,0,0,0,0,0,0,0,0,0,0,0,0,1
2025-07-03 18:51:00,45,"Louisiana: You have an incredible Congressman in Steve Scalise! As House Majority Leader, he fought hard to help us secure the Votes for the ??ONE BIG BEAUTIFUL BILL ACT?? ?? A HISTORIC WIN for our Country. Steve is a WARRIOR. Thank you to Steve, Jennifer, and the entire Scalise family!",False,louisiana steve scalise house historic steve warrior steve jennifer scalise incredible congressman majority leader fought hard help secure vote one big beautiful bill act win country thank entire family,['Uncertain'],"Geopolitics & Policy, Society & Labor, Real Estate & Housing","[0.222, 0.003, 0.0]",POSITIVE,0.999,"['one', 'historic steve', 'louisiana steve scalise', 'steve jennifer']",2,0,0,0,0,0,0,0,0,0,0,0,0,0,0,0,1
2025-07-03 18:29:00,46,"Minnesota: You have a GREAT Congressman in Tom Emmer. As Majority Whip, he was instrumental in helping us get the ??ONE BIG BEAUTIFUL BILL ACT,?? the BIGGEST OF ITS KIND ever approved in Congress. He is a fantastic guy with a fabulous wife Jacqueline and family.??Thank you to Tom Emmer and family!",False,minnesota great congressman tom emmer majority whip biggest congress jacqueline emmer instrumental helping u get one beautiful bill act kind ever approved fantastic guy fabulous wife family thank family,['Uncertain'],"Geopolitics & Policy, Society & Labor, Legal & Regulation","[0.011, 0.002, 0.0]",POSITIVE,0.9996,"['one', 'minnesota']",2,0,0,0,0,0,0,0,0,0,0,0,0,0,0,0,1
2025-07-03 18:15:00,47,"The Republicans in the House of Representatives have just passed the ??ONE BIG BEAUTIFUL BILL ACT.?? Our Party is UNITED like never before and, our Country is ??HOT.?? We are going to have a Signing Celebration at the White House tomorrow, at 4 P.M. EST. All??Congressmen/women and Senators are invited. Together, we will celebrate our Nation??s Independence, and the beginning of our new Golden Age. The people of the United States of America will be Richer, Safer, and Prouder than ever before. Thank you to Speaker of the House Mike Johnson, Senate Majority Leader John Thune, and all of the wonderful Republican Members of Congress who helped us deliver on our Promises, and so much more. Together, we can do things that were not even imagined possible less than one year ago. We will keep working, and winning ?? CONGRATULATIONS AMERICA!",False,house representatives party country white house independence golden age united states america richer safer house mike johnson senate john thune republican congress congratulations republican passed one big beautiful bill like never going signing celebration tomorrow est senator invited together celebrate nation beginning new people prouder ever thank speaker majority leader wonderful member helped deliver promise much together thing even imagined possible less one year ago keep working winning,['Uncertain'],"Geopolitics & Policy, Society & Labor, Legal & Regulation","[0.169, 0.0, 0.0]",POSITIVE,0.9996,"['tomorrow', 'house representatives party country', 'one', 'mike johnson', 'republican congress congratulations republican', 'age united states', 'john thune', 'senate', 'less one year ago', 'america']",2,0,0,0,0,0,0,0,0,0,0,0,0,0,0,0,1
2025-07-03 11:18:00,49,"We brought the price of Eggs back to what they were supposed to be. When I took over on January 20th, the Fake News was screaming that, ??Egg prices have gone through the roof, quadrupled,?? they said. Now they??re plentiful, and inexpensive. ??Thank you President Trump!??",False,eggs fake news trump brought price back supposed took january screaming price gone roof quadrupled plentiful inexpensive thank president,"['Financial Markets', 'Energy & Commodities', 'Crypto & Digital Assets', 'Macro Finance', 'Real Estate & Housing', 'Corporate Sector']","Financial Markets, Energy & Commodities, Crypto & Digital Assets","[1.0, 1.0, 0.999]",NEGATIVE,0.9981,['january'],1,0,0,1,1,0,1,1,0,0,0,1,1,0,0,0,0
2025-07-03 09:41:00,51,"What a great night it was. One of the most consequential Bills ever. The USA is the ??HOTTEST?? Country in the World, by far!!!",False,usa hottest great night one consequential bill ever country world far,['Uncertain'],"Financial Markets, Consumer & Retail, Macro Finance","[0.027, 0.011, 0.01]",POSITIVE,0.9988,['one'],1,0,0,0,0,0,0,0,0,0,0,0,0,0,0,0,1
2025-07-03 09:39:00,52,Will be speaking to President Putin of Russia at 10:00 A.M. Thank you!,False,putin russia speaking president thank,['Geopolitics & Policy'],"Geopolitics & Policy, Financial Markets, Education & Knowledge","[0.995, 0.001, 0.001]",POSITIVE,0.9996,['putin russia'],2,0,0,0,0,0,0,0,1,0,0,0,0,0,0,0,0
2025-07-03 09:36:00,53,"??This is good news; much better than expected.""""In our survey, economists were looking for [the unemployment rate] to climb up to 4.3 ?? It comes in at 4.1.""""Jobless claims ?? Much lower than expected.""",False,good news much better expected survey economist looking unemployment rate climb come jobless claim much lower expected,['Macro Finance'],"Macro Finance, Financial Markets, Society & Labor","[0.973, 0.026, 0.003]",NEGATIVE,0.9973,[],1,0,0,0,0,0,0,0,0,0,0,1,0,0,0,0,0
2025-07-02 21:34:00,57,"The USA is on track to break every record on GROWTH. Go Republicans, beat the Crooked Democrats tonight! PRO-GROWTH Tax Cuts never fail. MAKE AMERICA GREAT AGAIN!",False,usa growth crooked democrats make america track break every record go republican beat tonight tax cut never fail great,"['Macro Finance', 'Geopolitics & Policy', 'Financial Markets']","Macro Finance, Geopolitics & Policy, Financial Markets","[0.966, 0.942, 0.889]",POSITIVE,0.9977,"['republican', 'america', 'democrats', 'tonight']",1,0,0,0,0,0,0,1,1,0,0,1,0,0,0,0,0
2025-07-01 21:24:00,74,"Congresswoman Anna Paulina Luna was FANTASTIC tonight on ??Jesse Watters Primetime,?? as interviewed by fabulous Charlie Hurt. Thank you Anna! Also, thank you to Congressman Byron Donalds, and Stephen Dinan of the great Washington Times!",False,anna paulina luna fantastic jesse watters primetime charlie hurt congressman byron donalds stephen dinan washington times congresswoman tonight interviewed fabulous thank also thank great,['Uncertain'],"Geopolitics & Policy, Society & Labor, Legal & Regulation","[0.01, 0.0, 0.0]",POSITIVE,0.9997,"['charlie hurt', 'washington', 'tonight', 'anna paulina']",2,0,0,0,0,0,0,0,0,0,0,0,0,0,0,0,1
2025-07-01 15:06:00,77,"Thank you to the Highly Talented Artist, Vanessa Horabuena, and the incredible people of Colorado ?? Now on display in the Colorado State Capitol!",False,highly talented artist vanessa horabuena colorado colorado thank incredible people display state capitol,['Uncertain'],"Society & Labor, Geopolitics & Policy, Climate & Environment","[0.0, 0.0, 0.0]",POSITIVE,0.9997,"['capitol', 'colorado', 'vanessa horabuena']",2,0,0,0,0,0,0,0,0,0,0,0,0,0,0,0,1
2025-07-01 07:35:00,82,??TRUMP??S AGENDA IS IN THE BIG BEAUTIFUL BILL??,False,trump agenda big beautiful bill,['Geopolitics & Policy'],"Geopolitics & Policy, Financial Markets, Macro Finance","[0.952, 0.009, 0.002]",POSITIVE,0.9993,['trump agenda'],1,0,0,0,0,0,0,0,1,0,0,0,0,0,0,0,0
2025-06-30 14:20:00,87,"I apologize for the long wait on the Faith Leaders Conference Call. AT&T ought to get its act together. Please pass along the word to the tens of thousands of people who are there. We may have to reschedule the call, but we??ll use another carrier the next time. AT&T obviously doesn??t know what they??re doing!",False,faith leaders conference call apologize long wait ought get act together please pas along word ten thousand people may reschedule use another carrier next time obviously know,['Uncertain'],"Society & Labor, Transport & Logistics, Legal & Regulation","[0.242, 0.005, 0.0]",NEGATIVE,0.9976,['ten thousand'],2,0,0,0,0,0,0,0,0,0,0,0,0,0,0,0,1
2025-06-30 14:13:00,88,"I??m doing a major Conference Call with Faith Leaders from all over the Country, and AT&T is totally unable to make their equipment work properly. This is the second time it??s happened. If the Boss of AT&T, whoever that may be, could get involved ?? It would be good. There are tens of thousands of people on the line!",False,faith country at boss at major conference call leader totally unable make equipment work properly second time happened whoever may could get involved would good ten thousand people line,['Corporate Sector'],"Corporate Sector, Geopolitics & Policy, Society & Labor","[0.969, 0.066, 0.052]",NEGATIVE,0.9996,"['second', 'ten thousand']",2,0,0,1,0,0,0,0,0,0,0,0,0,0,0,0,0
