datetime,Unnamed: 0,text,isRetweet,processed_text,topics,top_3_topics,topic_confidences,sentiment,sentiment_score,named_entities,cluster,Climate & Environment,Consumer & Retail,Corporate Sector,Crypto & Digital Assets,Education & Knowledge,Energy & Commodities,Financial Markets,Geopolitics & Policy,Health & Biotech,Legal & Regulation,Macro Finance,Real Estate & Housing,Society & Labor,Tech & Innovation,Transport & Logistics,Uncertain
2025-03-04 07:30:00,1091,"All Federal Funding will STOP for any College, School, or University that allows illegal protests. Agitators will be imprisoned/or permanently sent back to the country from which they came. American students will be permanently expelled or, depending on on the crime, arrested. NO MASKS! Thank you for your attention to this matter.",False,college school university american masks federal funding stop allows illegal protest agitator permanently sent back country came student permanently expelled depending crime arrested thank attention matter,"['Legal & Regulation', 'Education & Knowledge']","Legal & Regulation, Education & Knowledge, Geopolitics & Policy","[0.991, 0.955, 0.132]",NEGATIVE,0.9972,"['college school university', 'american']",2,0,0,0,0,1,0,0,0,0,1,0,0,0,0,0,0
2025-03-03 13:32:00,1092,To the Great Farmers of the United States: Get ready to start making a lot of agricultural product to be sold INSIDE of the United States. Tariffs will go on external product on April 2nd. Have fun!,False,great farmers united states inside united states tariffs get ready start making lot agricultural product sold go external product april fun,['Uncertain'],"Macro Finance, Financial Markets, Geopolitics & Policy","[0.053, 0.006, 0.0]",POSITIVE,0.9983,"['united states', 'april']",1,0,0,0,0,0,0,0,0,0,0,0,0,0,0,0,1
2025-03-02 21:20:00,1097,"Exciting news! The Treasury Department has announced that they are suspending all enforcement of the outrageous and invasive Beneficial Ownership Information (BOI) reporting requirement for U.S. Citizens. This Biden rule has been an absolute disaster for Small Businesses Nationwide. Furthermore, Treasury is now finalizing an Emergency Regulation to formally suspend this rule for American businesses. The economic menace of BOI reporting will soon be no more.",False,treasury department beneficial ownership information boi u.s. citizens small businesses nationwide treasury emergency regulation american boi exciting news announced suspending enforcement outrageous invasive reporting requirement biden rule absolute disaster furthermore finalizing formally suspend rule economic menace reporting soon,"['Legal & Regulation', 'Corporate Sector', 'Macro Finance']","Legal & Regulation, Corporate Sector, Macro Finance","[0.999, 0.927, 0.779]",NEGATIVE,0.9975,"['u.s.', 'american', 'treasury department']",1,0,0,1,0,0,0,0,0,0,1,1,0,0,0,0,0
2025-03-02 21:19:00,1099,H.R. MCMASTER IS A WEAK AND TOTALLY INEFFECTIVE LOSER!,False,mcmaster weak totally ineffective loser,['Financial Markets'],"Financial Markets, Corporate Sector, Macro Finance","[0.948, 0.12, 0.023]",NEGATIVE,0.9997,[],2,0,0,0,0,0,0,1,0,0,0,0,0,0,0,0,0
2025-03-02 09:32:00,1102,"??President Trump is the best President we??ve ever had??a great businessman, and that??s what it??s about...Trump is the man for the job."" Floyd Mayweather",False,trump trump floyd mayweather president best president ever great businessman man job,['Uncertain'],"Geopolitics & Policy, Corporate Sector, Macro Finance","[0.066, 0.006, 0.0]",POSITIVE,0.9989,['floyd mayweather'],2,0,0,0,0,0,0,0,0,0,0,0,0,0,0,0,1
2025-03-01 12:01:00,1104,??The Rise of Young Republicans on America's College Campuses??,False,rise young republicans america college campuses,['Education & Knowledge'],"Education & Knowledge, Geopolitics & Policy, Crypto & Digital Assets","[0.984, 0.012, 0.001]",POSITIVE,0.9993,"['america', 'republicans']",2,0,0,0,0,1,0,0,0,0,0,0,0,0,0,0,0
2025-02-27 21:36:00,1113,"I am pleased to announce that Hung Cao will be our next United States Under Secretary of the Navy. Hung??is the embodiment of the American Dream. As a refugee to our Great Nation, Hung??worked tirelessly to make proud the Country that gave his family a home. He went to our amazing United States Naval Academy, and later earned his Master??s Degree in Physics. Hung served in combat as a Special Operations Officer for twenty five years. With Hung??s experience both in combat, and in the Pentagon, he will get the job done. Congratulations to Hung, and his wonderful family!",False,hung cao united states navy hung american dream great nation hung country united states naval academy master degree physics hung hung pentagon hung pleased announce next secretary embodiment refugee worked tirelessly make proud gave family home went amazing later earned served combat special operation officer twenty five year experience combat get job done congratulation wonderful family,['Uncertain'],"Education & Knowledge, Geopolitics & Policy, Legal & Regulation","[0.069, 0.016, 0.001]",POSITIVE,0.9987,"['united states naval academy', 'hung cao united states navy', 'american', 'twenty five year', 'pentagon']",2,0,0,0,0,0,0,0,0,0,0,0,0,0,0,0,1
2025-02-27 18:11:00,1115,"As usual, Sleepy Joe Biden left us a total MESS. The Budget from last YEAR is still not done. We are working very hard with the House and Senate to pass a clean, temporary government funding Bill (??CR??). Let??s get it done!",False,sleepy joe biden mess house senate bill usual left total budget last year still done working hard pas clean temporary government funding cr let get done,['Macro Finance'],"Macro Finance, Geopolitics & Policy, Financial Markets","[0.913, 0.003, 0.0]",NEGATIVE,0.9977,"['joe biden', 'last year', 'senate']",2,0,0,0,0,0,0,0,0,0,0,1,0,0,0,0,0
2025-02-27 14:43:00,1116,"A GREAT HONOR, THANK YOU!",False,great thank honor,['Uncertain'],"Financial Markets, Society & Labor, Education & Knowledge","[0.004, 0.003, 0.002]",POSITIVE,0.9999,[],2,0,0,0,0,0,0,0,0,0,0,0,0,0,0,0,1
2025-02-26 14:42:00,1120,"I'm very disappointed...four bodies came in today...We got a lot of hostages back, but it's very sad what happened to those people...This is a vicious group of people, and Israel's going to have to decide what they're doing??",False,israel disappointed four body came got lot hostage back sad happened people vicious group people going decide,['Geopolitics & Policy'],"Geopolitics & Policy, Society & Labor, Legal & Regulation","[0.983, 0.006, 0.001]",NEGATIVE,0.997,"['israel', 'four']",2,0,0,0,0,0,0,0,1,0,0,0,0,0,0,0,0
2025-02-26 14:38:00,1121,"Since the election, the CONFIDENCE in our nation...the CONFIDENCE in business, the CONFIDENCE in the Country has reached an ALL-TIME HIGH. We have never reached levels like we are right now??",False,confidence confidence confidence country high since election nation business reached never reached level like right,"['Financial Markets', 'Corporate Sector', 'Macro Finance']","Financial Markets, Corporate Sector, Macro Finance","[0.995, 0.979, 0.976]",POSITIVE,0.9981,[],1,0,0,1,0,0,0,1,0,0,0,1,0,0,0,0,0
2025-02-26 14:32:00,1123,Elon Musk: ??President Trump has put together the best Cabinet ever...And I do not give false praise. This is an incredible group of people. I don't think such a talented team has ever been assembled????,False,elon musk trump president put together best cabinet ever give false praise incredible group people think talented team ever,['Uncertain'],"Geopolitics & Policy, Financial Markets, Corporate Sector","[0.065, 0.001, 0.0]",POSITIVE,0.9971,['elon musk trump'],2,0,0,0,0,0,0,0,0,0,0,0,0,0,0,0,1
2025-02-26 09:03:00,1129,ALL CABINET MEMBERS ARE EXTREMELY HAPPY WITH ELON. The Media will see that at the Cabinet Meeting this morning!!!,False,are media cabinet member extremely happy elon see meeting morning,['Uncertain'],"Corporate Sector, Geopolitics & Policy, Macro Finance","[0.003, 0.002, 0.001]",POSITIVE,0.9997,[],2,0,0,0,0,0,0,0,0,0,0,0,0,0,0,0,1
2025-02-26 07:31:00,1132,AMERICA LOVES TOM HOMAN!!!,False,america loves tom homan,['Uncertain'],"Geopolitics & Policy, Financial Markets, Corporate Sector","[0.295, 0.027, 0.013]",POSITIVE,0.9995,['america'],2,0,0,0,0,0,0,0,0,0,0,0,0,0,0,0,1
2025-02-26 07:29:00,1133,"Congratulations to the U.S. Dockworkers on your great new deal. Also, thank you for your overwhelming support in the Presidential Election. Slowing down automation, just a little bit, is an OK thing to do!!! DJT",False,u.s. congratulation dockworker great new deal also thank overwhelming support presidential election slowing automation little bit ok thing djt,"['Tech & Innovation', 'Corporate Sector', 'Transport & Logistics']","Tech & Innovation, Corporate Sector, Transport & Logistics","[0.999, 0.979, 0.728]",POSITIVE,0.9971,['u.s.'],1,0,0,1,0,0,0,0,0,0,0,0,0,0,1,1,0
2025-02-26 07:23:00,1134,"Mark Levin??s last two shows, Saturday and Sunday, were incredible, a MUST SEE. I think we??re going to have to open a beautiful MUSEUM to honor the words and wisdom of ??The Great One,?? Mark Levin!!!",False,mark levin must museum great one mark levin last two show saturday sunday incredible see think going open beautiful honor word wisdom,['Education & Knowledge'],"Education & Knowledge, Society & Labor, Financial Markets","[0.724, 0.0, 0.0]",POSITIVE,0.9997,"['saturday', 'mark levin', 'sunday', 'last two']",2,0,0,0,0,1,0,0,0,0,0,0,0,0,0,0,0
2025-02-26 07:10:00,1135,"As a President who is being given credit for having the Best Opening Month of any President in history, quite naturally, here come the Fake books and stories with the so-called ??anonymous,?? or ??off the record,?? quotes. At some point I am going to sue some of these dishonest authors and book publishers, or even media in general, to find out whether or not these ??anonymous sources?? even exist, which they largely do not. They are made up, defamatory fiction, and a big price should be paid for this blatant dishonesty. I??ll do it as a service to our Country. Who knows, maybe we will create some NICE NEW LAW!!!",False,month fake nice president given credit best opening president history quite naturally come book story anonymous record quote point going sue dishonest author book publisher even medium general find whether anonymous source even exist largely made defamatory fiction big price paid blatant dishonesty service country know maybe create new law,"['Legal & Regulation', 'Geopolitics & Policy']","Legal & Regulation, Geopolitics & Policy, Society & Labor","[0.974, 0.799, 0.002]",NEGATIVE,0.9975,[],2,0,0,0,0,0,0,0,1,0,1,0,0,0,0,0,0
2025-02-25 22:33:00,1137,"Congratulations to Coach Tommy Tuberville and family on the birth of a very special and beautiful granddaughter, Rosie Grace Tuberville. Tommy was a Great Coach, is a spectacular Senator, loves our Country, and deserves everything he gets. Congratulations to the entire Tuberville family!",False,coach tommy tuberville rosie grace tuberville tommy great coach tuberville congratulation family birth special beautiful granddaughter spectacular senator love country deserves everything get congratulation entire family,['Uncertain'],"Transport & Logistics, Society & Labor, Geopolitics & Policy","[0.423, 0.006, 0.005]",POSITIVE,0.9991,"['rosie grace', 'tommy tuberville']",2,0,0,0,0,0,0,0,0,0,0,0,0,0,0,0,1
2025-02-25 16:49:00,1142,??TRUMP WAS RIGHT ABOUT EVERYTHING??,False,trump right everything,"['Financial Markets', 'Geopolitics & Policy']","Financial Markets, Geopolitics & Policy, Macro Finance","[0.766, 0.7, 0.134]",POSITIVE,0.9983,[],2,0,0,0,0,0,0,1,1,0,0,0,0,0,0,0,0
2025-02-25 10:12:00,1143,A must watch with Mark Levin and Victor Davis Hanson??,False,mark levin victor davis must watch,['Uncertain'],"Financial Markets, Tech & Innovation, Macro Finance","[0.024, 0.002, 0.002]",POSITIVE,0.9994,"['mark levin victor', 'davis']",2,0,0,0,0,0,0,0,0,0,0,0,0,0,0,0,1
2025-02-24 21:51:00,1144,"VIVEK RAMASWAMY is running for Governor of the Great State of Ohio. I know him well, competed against him, and he is something SPECIAL. He??s Young, Strong, and Smart! Vivek is also a very good person, who truly loves our Country. He will be a GREAT Governor of Ohio, will never let you down, and has my COMPLETE AND TOTAL ENDORSEMENT!",False,vivek ramaswamy great ohio strong smart vivek great ohio complete total running governor state know well competed something special young also good person truly love country governor never endorsement,['Uncertain'],"Geopolitics & Policy, Education & Knowledge, Society & Labor","[0.114, 0.001, 0.0]",POSITIVE,0.9991,['ohio'],2,0,0,0,0,0,0,0,0,0,0,0,0,0,0,0,1
2025-02-24 16:09:00,1149,"France is America's oldest ally. Our cherished partnership has been a force for FREEDOM, PROSPERITY, and PEACE from the very beginning??",False,france america freedom prosperity peace oldest ally cherished partnership force,['Geopolitics & Policy'],"Geopolitics & Policy, Society & Labor, Climate & Environment","[0.998, 0.0, 0.0]",POSITIVE,0.9993,"['france', 'america']",1,0,0,0,0,0,0,0,1,0,0,0,0,0,0,0,0
2025-02-24 12:00:00,1152,"Today, President Emmanuel Macron of France joined me in the Oval Office to speak to the G7 Summit. The meeting was convened by Governor Justin Trudeau of Canada, the current chair of G7, to acknowledge the Third Anniversary of the Russia-Ukraine War ?? Which would have never started if I was President. Everyone expressed their goal of seeing the War end, and I emphasized the importance of the vital ??Critical Minerals and Rare-Earths Deal?? between the United States and Ukraine, which we hope will be signed very soon! This deal, which is an ??Economic Partnership,?? will ensure the American people recoup the Tens of Billions of Dollars and Military Equipment sent to Ukraine, while also helping Ukraine??s economy grow as this Brutal and Savage War comes to an end. At the same time, I am in serious discussions with President Vladimir Putin of Russia concerning the ending of the War, and also major Economic Development transactions which will take place between the United States and Russia. Talks are proceeding very well!??",False,emmanuel macron france oval office justin trudeau canada g7 united states ukraine economic partnership american tens billions dollars military equipment ukraine ukraine brutal savage war vladimir putin russia economic united states russia president joined speak summit meeting convened governor current chair acknowledge third anniversary would never started president everyone expressed goal seeing end emphasized importance vital critical mineral deal hope signed soon deal ensure people recoup sent also helping economy grow come end time serious discussion president concerning ending also major development transaction take place talk proceeding well,['Geopolitics & Policy'],"Geopolitics & Policy, Macro Finance, Energy & Commodities","[0.997, 0.016, 0.006]",POSITIVE,0.998,"['united states', 'canada', 'third', 'ukraine ukraine', 'putin russia', 'russia', 'tens billions dollars', 'france', 'justin trudeau', 'emmanuel macron']",2,0,0,0,0,0,0,0,1,0,0,0,0,0,0,0,0
2025-02-24 00:55:00,1158,"RT @realDonaldTrumpMSNBC, COMMONLY KNOWN AS MSDNC, IS A THREAT TO OUR DEMOCRACY. SUCH LYING AND MISREPRESENTATION. BAD PEOPLE AT THE TOP!",True,commonly misrepresentation bad the rt realdonaldtrumpmsnbc known msdnc threat democracy lying people top,['Geopolitics & Policy'],"Geopolitics & Policy, Financial Markets, Legal & Regulation","[0.767, 0.021, 0.004]",NEGATIVE,0.9982,[],2,0,0,0,0,0,0,0,1,0,0,0,0,0,0,0,0
2025-02-24 00:54:00,1160,"RT @realDonaldTrumpSo-called ??Author?? Michael Wolff??s new book is a total FAKE JOB, just like the other JUNK he wrote. He called me many times trying to set up a meeting, but I never called him back because I didn??t want to give him the credibility of an interview. Others in the Administration were also called, they reported his calls, and likewise, did not talk to him. I assume, however, he was able to speak to a small number of people, but not meaningfully. His other books about me have been discredited, as this one will be also. I am one who believes in commenting about FAKE NEWS, or made up stories, even if you have to ??punch low,?? and shouldn??t be wasting the time required to do so. We had one of the Greatest Elections in History, and perhaps the Greatest First Month EVER, according to almost everybody, but Wolff doesn??t want to talk about that. He mentions the people that surrounded me during the Election, and in many cases now, in derogatory terms, but they couldn??t have been that bad because here I am in the White House, refusing to take his calls. Wolff says he has sources, but he doesn??t have them, it??s a LIE, as is the case with many so-called ??journalists.?? If he has sources, let them be revealed. Watch, it will never happen. He is FAKE NEWS, a total LOSER, and no one should waste their time or money in buying this boring and obviously fictitious book!",True,michael wolff fake administration fake greatest history greatest wolff election white house wolff lie fake news loser rt author book total job like junk wrote called many time trying set meeting never called back want give credibility interview others also called reported call likewise talk assume however able speak small number people meaningfully book discredited one also one belief commenting made story even punch low wasting time required one election perhaps first month ever almost everybody want talk mention people surrounded many case derogatory term bad refusing take call say source case many source let revealed watch never happen total one waste time money buying boring obviously fictitious book,['Legal & Regulation'],"Legal & Regulation, Geopolitics & Policy, Corporate Sector","[0.632, 0.025, 0.009]",NEGATIVE,0.9974,"['one', 'first month', 'michael wolff fake administration fake']",2,0,0,0,0,0,0,0,0,0,1,0,0,0,0,0,0
2025-02-24 00:53:00,1162,"RT @realDonaldTrumpGreat news for Law Enforcement and American Justice! Dan Bongino, a man of incredible love and passion for our Country, has just been named the next DEPUTY DIRECTOR OF THE FBI, by the man who will be the best ever Director, Kash Patel. Dan has a Masters Degree in Psychology from C.U.N.Y., and an MBA from Penn State. He was a member of the New York Police Department (New York??s Finest!), a highly respected Special Agent with the United States Secret Service, and is now one of the most successful Podcasters in the Country, something he is willing and prepared to give up in order to serve. Working with our great new United States Attorney General, Pam Bondi, and Director Patel, Fairness, Justice, Law and Order will be brought back to America, and quickly. Congratulations Dan!",True,law enforcement american dan bongino the fbi kash patel dan masters degree psychology c.u.n.y. penn state new york new york special agent united states secret service country united states pam bondi director patel fairness justice law order america dan rt realdonaldtrumpgreat news man incredible love passion named next deputy man best ever mba member police department finest highly respected one successful podcasters something willing prepared give serve working great attorney general brought back quickly congratulation,['Legal & Regulation'],"Legal & Regulation, Education & Knowledge, Geopolitics & Policy","[0.823, 0.024, 0.001]",POSITIVE,0.9976,"['patel dan', 'one', 'american', 'new york', 'fbi', 'united states pam bondi', 'penn state', 'patel fairness justice', 'america dan rt realdonaldtrumpgreat news', 'dan bongino']",2,0,0,0,0,0,0,0,0,0,1,0,0,0,0,0,0
2025-02-24 00:53:00,1163,"RT @realDonaldTrumpLowlife Chairman of ??Concast,?? Brian Roberts, the owner of Ratings Challenged NBC and MSDNC, has finally gotten the nerve up to fire one of the least talented people in television, the mentally obnoxious racist, Joy Reid. Based on her ratings, which were virtually non-existent, she should have been ??canned?? long ago, along with everyone else who works there. Also thrown out was Alex Wagner, the sub on the seriously failing Rachel Maddow show. Rachel rarely shows up because she knows there??s nobody watching, and she also knows that she??s got less television persona than virtually anyone on television except, perhaps, Joy Reid. Then there??s, of course, the LOW IQ Con Man, Al Sharpton, who has, perhaps, the lowest TV ratings in the history of television. What is he doing to Brian Roberts to stay on the air? This whole corrupt operation is nothing more than an illegal arm of the Democrat Party. They should be forced to pay vast sums of money for the damage they??ve done to our Country. Fake News is an UNPARDONABLE SIN!",True,brian roberts ratings msdnc joy reid alex wagner rachel maddow rachel joy reid low al sharpton brian democrat party fake news unpardonable sin realdonaldtrumplowlife chairman concast owner challenged nbc finally gotten nerve fire one least talented people television mentally obnoxious racist based virtually canned long ago along everyone else work also thrown sub seriously failing show rarely show know nobody watching also know got less television persona virtually anyone television except perhaps course iq con man perhaps lowest tv history television stay air whole corrupt operation nothing illegal arm forced pay vast sum money damage done country,['Uncertain'],"Corporate Sector, Geopolitics & Policy, Legal & Regulation","[0.01, 0.004, 0.002]",NEGATIVE,0.9989,"['brian roberts', 'reid alex wagner', 'one', 'rachel maddow rachel joy reid', 'al sharpton brian', 'nbc', 'democrat']",2,0,0,0,0,0,0,0,0,0,0,0,0,0,0,0,1
2025-02-23 23:18:00,1164,"Lowlife Chairman of ??Concast,?? Brian Roberts, the owner of Ratings Challenged NBC and MSDNC, has finally gotten the nerve up to fire one of the least talented people in television, the mentally obnoxious racist, Joy Reid. Based on her ratings, which were virtually non-existent, she should have been ??canned?? long ago, along with everyone else who works there. Also thrown out was Alex Wagner, the sub on the seriously failing Rachel Maddow show. Rachel rarely shows up because she knows there??s nobody watching, and she also knows that she??s got less television persona than virtually anyone on television except, perhaps, Joy Reid. Then there??s, of course, the LOW IQ Con Man, Al Sharpton, who has, perhaps, the lowest TV ratings in the history of television. What is he doing to Brian Roberts to stay on the air? This whole corrupt operation is nothing more than an illegal arm of the Democrat Party. They should be forced to pay vast sums of money for the damage they??ve done to our Country. Fake News is an UNPARDONABLE SIN!",False,lowlife brian roberts ratings msdnc joy reid alex wagner rachel maddow rachel joy reid low al sharpton brian democrat party fake news unpardonable sin chairman concast owner challenged nbc finally gotten nerve fire one least talented people television mentally obnoxious racist based virtually canned long ago along everyone else work also thrown sub seriously failing show rarely show know nobody watching also know got less television persona virtually anyone television except perhaps course iq con man perhaps lowest tv history television stay air whole corrupt operation nothing illegal arm forced pay vast sum money damage done country,['Uncertain'],"Corporate Sector, Legal & Regulation, Geopolitics & Policy","[0.01, 0.003, 0.002]",NEGATIVE,0.9992,"['brian roberts', 'reid alex wagner', 'one', 'rachel maddow rachel joy reid', 'al sharpton brian', 'nbc', 'democrat']",2,0,0,0,0,0,0,0,0,0,0,0,0,0,0,0,1
2025-02-23 20:50:00,1165,"Another aspect of the life of Dan Bongino that I think is very important. He has a great wife, Paula, and two wonderful daughters who truly love their dad. What an incredible job Dan will do!!!",False,dan bongino paula dan another aspect life think important great wife two wonderful daughter truly love dad incredible job,['Uncertain'],"Corporate Sector, Society & Labor, Financial Markets","[0.024, 0.006, 0.0]",POSITIVE,0.9993,"['two', 'dan bongino', 'paula dan']",2,0,0,0,0,0,0,0,0,0,0,0,0,0,0,0,1
2025-02-23 20:41:00,1166,"Great news for Law Enforcement and American Justice! Dan Bongino, a man of incredible love and passion for our Country, has just been named the next DEPUTY DIRECTOR OF THE FBI, by the man who will be the best ever Director, Kash Patel. Dan has a Masters Degree in Psychology from C.U.N.Y., and an MBA from Penn State. He was a member of the New York Police Department (New York??s Finest!), a highly respected Special Agent with the United States Secret Service, and is now one of the most successful Podcasters in the Country, something he is willing and prepared to give up in order to serve. Working with our great new United States Attorney General, Pam Bondi, and Director Patel, Fairness, Justice, Law and Order will be brought back to America, and quickly. Congratulations Dan!",False,great law enforcement american dan bongino the fbi kash patel dan masters degree psychology c.u.n.y. penn state new york new york special agent united states secret service country united states pam bondi director patel fairness justice law order america dan news man incredible love passion named next deputy man best ever mba member police department finest highly respected one successful podcasters something willing prepared give serve working attorney general brought back quickly congratulation,['Legal & Regulation'],"Legal & Regulation, Education & Knowledge, Geopolitics & Policy","[0.86, 0.033, 0.001]",POSITIVE,0.999,"['patel dan', 'one', 'american', 'new york', 'fbi', 'united states pam bondi', 'penn state', 'patel fairness justice', 'dan bongino', 'america dan news']",2,0,0,0,0,0,0,0,0,0,1,0,0,0,0,0,0
